{
  "$schema": "https://json-schema.org/draft/2020-12/schema",
  "title": "LayeredValidationReport",
  "type": "object",
  "required": ["report_version", "validation_state", "source_case_id", "source_replay_state", "validation_profile_id", "validation_profile_identity", "applicable_layers", "layer_results", "identity_bindings", "closure_result", "reproduction_result", "equivalence_result", "replay_fact_drift", "proof_fact_drift", "proof_parity_eligibility", "proof_parity_eligible", "proof_parity", "proof_correctness", "primary_reason", "reason_codes", "hardware_validation"],
  "properties": {
    "report_version": {"const": "external-layered-validation-report-v1", "enum": ["external-layered-validation-report-v1"]},
    "validation_state": {"enum": ["not_evaluated", "reference_only", "validation_pass", "validation_fail"]},
    "source_case_id": {"type": "string", "minLength": 1, "pattern": "^[^/\\\\\\u0000]+$"},
    "source_replay_state": {"enum": ["not_evaluated", "reference_only", "replay_pass", "replay_fail"]},
    "validation_profile_id": {"type": "string", "minLength": 1, "pattern": "^[^/\\\\\\u0000]+$"},
    "validation_profile_identity": {"type": "string", "pattern": "^[0-9a-f]{64}$"},
    "applicable_layers": {"type": "array", "items": {"enum": ["source_identity", "artifact_identity", "checksum_integrity", "package_completeness", "evidence_closure", "p7_4_report_schema", "cross_phase_identity_binding", "replay_reproduction", "result_equivalence", "replay_fact_drift", "proof_fact_comparability", "proof_parity_eligibility"]}},
    "layer_results": {"type": "array", "items": {"type": "object", "required": ["layer", "layer_state", "reason_codes"], "properties": {"layer": {"type": "string"}, "layer_state": {"enum": ["passed", "failed", "not_applicable", "not_evaluated"]}, "reason_codes": {"type": "array", "items": {"type": "string"}}}, "additionalProperties": false}},
    "identity_bindings": {"type": "array", "items": {"type": "object", "required": ["binding_kind", "expected_identity", "actual_identity", "matched"], "properties": {"binding_kind": {"type": "string", "minLength": 1}, "expected_identity": {"type": "string", "pattern": "^[0-9a-f]{64}$"}, "actual_identity": {"type": "string", "pattern": "^[0-9a-f]{64}$"}, "matched": {"type": "boolean"}}, "additionalProperties": false}},
    "closure_result": {"type": "object", "required": ["required_artifact_count", "present_artifact_count", "closure_state"], "properties": {"required_artifact_count": {"type": "integer", "minimum": 0}, "present_artifact_count": {"type": "integer", "minimum": 0}, "closure_state": {"enum": ["passed", "failed", "not_applicable"]}}, "additionalProperties": false},
    "reproduction_result": {"type": "object", "required": ["reproduction_attempted", "canonical_bytes_matched", "canonical_sha256_matched", "reproduced_report_sha256"], "properties": {"reproduction_attempted": {"type": "boolean"}, "canonical_bytes_matched": {"type": "boolean"}, "canonical_sha256_matched": {"type": "boolean"}, "reproduced_report_sha256": {"type": ["string", "null"], "pattern": "^[0-9a-f]{64}$"}}, "additionalProperties": false},
    "equivalence_result": {"type": "object", "required": ["equivalent", "compared_field_count", "mismatch_fields"], "properties": {"equivalent": {"type": "boolean"}, "compared_field_count": {"type": "integer", "minimum": 0}, "mismatch_fields": {"type": "array", "items": {"type": "string"}}}, "additionalProperties": false},
    "replay_fact_drift": {"type": "object", "required": ["comparable_replay_fact_count", "replay_fact_drift_count", "replay_fact_drift_items"], "properties": {"comparable_replay_fact_count": {"type": "integer", "minimum": 0}, "replay_fact_drift_count": {"type": "integer", "minimum": 0}, "replay_fact_drift_items": {"type": "array", "items": {"type": "object", "required": ["fact_id", "expected_value", "actual_value"], "properties": {"fact_id": {"type": "string"}, "expected_value": {"type": ["string", "integer", "boolean", "null"]}, "actual_value": {"type": ["string", "integer", "boolean", "null"]}}, "additionalProperties": false}}}, "additionalProperties": false},
    "proof_fact_drift": {"type": "object", "required": ["comparable_proof_fact_count", "proof_drift_count", "proof_drift_items"], "properties": {"comparable_proof_fact_count": {"type": "integer", "minimum": 0}, "proof_drift_count": {"type": "integer", "minimum": 0}, "proof_drift_items": {"type": "array", "items": {"type": "object", "required": ["fact_id", "expected_value", "actual_value"], "properties": {"fact_id": {"type": "string"}, "expected_value": {"type": ["string", "integer", "boolean", "null"]}, "actual_value": {"type": ["string", "integer", "boolean", "null"]}}, "additionalProperties": false}}}, "additionalProperties": false},
    "proof_parity_eligibility": {"type": "object", "required": ["proof_parity_eligible", "proof_parity", "proof_parity_reason", "proof_correctness"], "properties": {"proof_parity_eligible": {"type": "boolean"}, "proof_parity": {"enum": ["not_evaluated", "parity_pass", "parity_fail"]}, "proof_parity_reason": {"type": "string", "minLength": 1}, "proof_correctness": {"const": "not_evaluated", "enum": ["not_evaluated"]}}, "additionalProperties": false},
    "proof_parity_eligible": {"type": "boolean"},
    "proof_parity": {"enum": ["not_evaluated", "parity_pass", "parity_fail"]},
    "proof_correctness": {"const": "not_evaluated", "enum": ["not_evaluated"]},
    "primary_reason": {"type": ["string", "null"]},
    "reason_codes": {"type": "array", "items": {"type": "string"}},
    "hardware_validation": {"const": false, "enum": [false]}
  },
  "additionalProperties": false
}
