{"applicable_layers":["source_identity","artifact_identity","checksum_integrity","package_completeness","evidence_closure","p7_4_report_schema","cross_phase_identity_binding","replay_reproduction","result_equivalence","replay_fact_drift","proof_fact_comparability","proof_parity_eligibility"],"closure_result":{"closure_state":"passed","present_artifact_count":12,"required_artifact_count":12},"equivalence_result":{"compared_field_count":32,"equivalent":true,"mismatch_fields":[]},"hardware_validation":false,"identity_bindings":[{"actual_identity":"1d9942dffbb8dde1cb89a65370095904b7c5929b187144a591d5561d247ede73","binding_kind":"binding_fixture_sha256","expected_identity":"1d9942dffbb8dde1cb89a65370095904b7c5929b187144a591d5561d247ede73","matched":true},{"actual_identity":"f80803eea21de187d93baa871b27df0e99a9e6432334830644be5c2f71eb2cbe","binding_kind":"embedded_binding_identity","expected_identity":"f80803eea21de187d93baa871b27df0e99a9e6432334830644be5c2f71eb2cbe","matched":true},{"actual_identity":"571183cbafba85f0eeb9c74cf2350f02a4e628abe514409dd3c1b68286969f44","binding_kind":"p7_2_to_p7_4_trace_identity","expected_identity":"571183cbafba85f0eeb9c74cf2350f02a4e628abe514409dd3c1b68286969f44","matched":true},{"actual_identity":"6853e36276ed9fe26e7db68c309ce612207bdfbf6c97f336e17b50b48715c3ab","binding_kind":"p7_3_package_identity","expected_identity":"6853e36276ed9fe26e7db68c309ce612207bdfbf6c97f336e17b50b48715c3ab","matched":true},{"actual_identity":"38d2b227066de0f17bffde223bf03aeef4702f5c45c94030cccaa763d77e564d","binding_kind":"p7_4_expected_identity","expected_identity":"38d2b227066de0f17bffde223bf03aeef4702f5c45c94030cccaa763d77e564d","matched":true},{"actual_identity":"61efa43907c452fafdf61f5d3e91a0928ceefdb68c4b49041094fbc389ad1bd2","binding_kind":"p7_4_profile_identity","expected_identity":"61efa43907c452fafdf61f5d3e91a0928ceefdb68c4b49041094fbc389ad1bd2","matched":true}],"layer_results":[{"layer":"source_identity","layer_state":"passed","reason_codes":[]},{"layer":"artifact_identity","layer_state":"passed","reason_codes":[]},{"layer":"checksum_integrity","layer_state":"passed","reason_codes":[]},{"layer":"package_completeness","layer_state":"passed","reason_codes":[]},{"layer":"evidence_closure","layer_state":"passed","reason_codes":[]},{"layer":"p7_4_report_schema","layer_state":"passed","reason_codes":[]},{"layer":"cross_phase_identity_binding","layer_state":"passed","reason_codes":[]},{"layer":"replay_reproduction","layer_state":"passed","reason_codes":[]},{"layer":"result_equivalence","layer_state":"passed","reason_codes":[]},{"layer":"replay_fact_drift","layer_state":"passed","reason_codes":[]},{"layer":"proof_fact_comparability","layer_state":"not_applicable","reason_codes":[]},{"layer":"proof_parity_eligibility","layer_state":"passed","reason_codes":[]}],"primary_reason":null,"proof_correctness":"not_evaluated","proof_fact_drift":{"comparable_proof_fact_count":0,"proof_drift_count":0,"proof_drift_items":[]},"proof_parity":"not_evaluated","proof_parity_eligibility":{"proof_correctness":"not_evaluated","proof_parity":"not_evaluated","proof_parity_eligible":false,"proof_parity_reason":"FROZEN_PROOF_REPRESENTATION_UNAVAILABLE"},"proof_parity_eligible":false,"reason_codes":[],"replay_fact_drift":{"comparable_replay_fact_count":17,"replay_fact_drift_count":0,"replay_fact_drift_items":[]},"report_version":"external-layered-validation-report-v1","reproduction_result":{"canonical_bytes_matched":true,"canonical_sha256_matched":true,"reproduced_report_sha256":"c75143ce8c2c2ec689289a6e52848cb5c4fca42ce343f6710571075478708b8d","reproduction_attempted":true},"source_case_id":"freertos_btf_1core","source_replay_state":"replay_pass","validation_profile_id":"p7.5-layered-validation-v1","validation_profile_identity":"4114e58b3a09bef2cda27d33b1172e3c379a204f4bbcbc4384b08e8be118eaaf","validation_state":"validation_pass"}
