{"applicable_layers":["source_identity","artifact_identity","checksum_integrity","package_completeness","evidence_closure","p7_4_report_schema","cross_phase_identity_binding","replay_reproduction","result_equivalence","replay_fact_drift","proof_fact_comparability","proof_parity_eligibility"],"closure_result":{"closure_state":"passed","present_artifact_count":12,"required_artifact_count":12},"equivalence_result":{"compared_field_count":32,"equivalent":true,"mismatch_fields":[]},"hardware_validation":false,"identity_bindings":[{"actual_identity":"bdf840f27f64d7a226b9141d67c9dcf74f052630482baab7209d7b06913b89b4","binding_kind":"binding_fixture_sha256","expected_identity":"bdf840f27f64d7a226b9141d67c9dcf74f052630482baab7209d7b06913b89b4","matched":true},{"actual_identity":"201d7c7dca1ba19597a7f3295c3f1145e4fe6c276369769ed9f98224c63bfedc","binding_kind":"embedded_binding_identity","expected_identity":"201d7c7dca1ba19597a7f3295c3f1145e4fe6c276369769ed9f98224c63bfedc","matched":true},{"actual_identity":"f032a6af43334abc5c5fbed6b145e711f0262e2b1dfa6d3a44a28c37b6308baa","binding_kind":"p7_2_to_p7_4_trace_identity","expected_identity":"f032a6af43334abc5c5fbed6b145e711f0262e2b1dfa6d3a44a28c37b6308baa","matched":true},{"actual_identity":"364a9a28c73518f3fdcd1c37dca9b9deacdf6c3e1806bd2a630d8431f6caa6a0","binding_kind":"p7_3_package_identity","expected_identity":"364a9a28c73518f3fdcd1c37dca9b9deacdf6c3e1806bd2a630d8431f6caa6a0","matched":true},{"actual_identity":"be9fe5e76958583d06987914e4211f00cf74f3481f38980d560a984c3951bc98","binding_kind":"p7_4_expected_identity","expected_identity":"be9fe5e76958583d06987914e4211f00cf74f3481f38980d560a984c3951bc98","matched":true},{"actual_identity":"61efa43907c452fafdf61f5d3e91a0928ceefdb68c4b49041094fbc389ad1bd2","binding_kind":"p7_4_profile_identity","expected_identity":"61efa43907c452fafdf61f5d3e91a0928ceefdb68c4b49041094fbc389ad1bd2","matched":true}],"layer_results":[{"layer":"source_identity","layer_state":"passed","reason_codes":[]},{"layer":"artifact_identity","layer_state":"passed","reason_codes":[]},{"layer":"checksum_integrity","layer_state":"passed","reason_codes":[]},{"layer":"package_completeness","layer_state":"passed","reason_codes":[]},{"layer":"evidence_closure","layer_state":"passed","reason_codes":[]},{"layer":"p7_4_report_schema","layer_state":"passed","reason_codes":[]},{"layer":"cross_phase_identity_binding","layer_state":"passed","reason_codes":[]},{"layer":"replay_reproduction","layer_state":"passed","reason_codes":[]},{"layer":"result_equivalence","layer_state":"passed","reason_codes":[]},{"layer":"replay_fact_drift","layer_state":"passed","reason_codes":[]},{"layer":"proof_fact_comparability","layer_state":"not_applicable","reason_codes":[]},{"layer":"proof_parity_eligibility","layer_state":"passed","reason_codes":[]}],"primary_reason":null,"proof_correctness":"not_evaluated","proof_fact_drift":{"comparable_proof_fact_count":0,"proof_drift_count":0,"proof_drift_items":[]},"proof_parity":"not_evaluated","proof_parity_eligibility":{"proof_correctness":"not_evaluated","proof_parity":"not_evaluated","proof_parity_eligible":false,"proof_parity_reason":"FROZEN_PROOF_REPRESENTATION_UNAVAILABLE"},"proof_parity_eligible":false,"reason_codes":[],"replay_fact_drift":{"comparable_replay_fact_count":17,"replay_fact_drift_count":0,"replay_fact_drift_items":[]},"report_version":"external-layered-validation-report-v1","reproduction_result":{"canonical_bytes_matched":true,"canonical_sha256_matched":true,"reproduced_report_sha256":"97ef68f12bd085ed66fb0fff50c65134c70cf91b0b433991e01f9ec1fd2f98e3","reproduction_attempted":true},"source_case_id":"freertos_btf_50k","source_replay_state":"replay_fail","validation_profile_id":"p7.5-layered-validation-v1","validation_profile_identity":"4114e58b3a09bef2cda27d33b1172e3c379a204f4bbcbc4384b08e8be118eaaf","validation_state":"validation_pass"}
