{"applicable_layers":["source_identity","artifact_identity","checksum_integrity","package_completeness","evidence_closure","p7_4_report_schema","cross_phase_identity_binding","replay_reproduction","result_equivalence","replay_fact_drift","proof_fact_comparability","proof_parity_eligibility"],"closure_result":{"closure_state":"passed","present_artifact_count":12,"required_artifact_count":12},"equivalence_result":{"compared_field_count":32,"equivalent":true,"mismatch_fields":[]},"hardware_validation":false,"identity_bindings":[{"actual_identity":"f1efcca8c9b86fd373771bb20154767481ffd5112549a399f232af7d183161ea","binding_kind":"binding_fixture_sha256","expected_identity":"f1efcca8c9b86fd373771bb20154767481ffd5112549a399f232af7d183161ea","matched":true},{"actual_identity":"673bf36b77b87779a57e0d3a3a7414b313a9cbf302c3208b508e58518556a1cf","binding_kind":"embedded_binding_identity","expected_identity":"673bf36b77b87779a57e0d3a3a7414b313a9cbf302c3208b508e58518556a1cf","matched":true},{"actual_identity":"eb15beee65c62d53a3bbf9db5ebb36318156b720e4bd909272605dfeb1c6eed1","binding_kind":"p7_2_to_p7_4_trace_identity","expected_identity":"eb15beee65c62d53a3bbf9db5ebb36318156b720e4bd909272605dfeb1c6eed1","matched":true},{"actual_identity":"44f5d5df393d05cd4a836605e585a6989f8307dbe22aef7f0e722601856a5613","binding_kind":"p7_3_package_identity","expected_identity":"44f5d5df393d05cd4a836605e585a6989f8307dbe22aef7f0e722601856a5613","matched":true},{"actual_identity":"8f36465fc910e535a759748af57d175d1ae9889c973bedafc5b62b572bbceab6","binding_kind":"p7_4_expected_identity","expected_identity":"8f36465fc910e535a759748af57d175d1ae9889c973bedafc5b62b572bbceab6","matched":true},{"actual_identity":"61efa43907c452fafdf61f5d3e91a0928ceefdb68c4b49041094fbc389ad1bd2","binding_kind":"p7_4_profile_identity","expected_identity":"61efa43907c452fafdf61f5d3e91a0928ceefdb68c4b49041094fbc389ad1bd2","matched":true}],"layer_results":[{"layer":"source_identity","layer_state":"passed","reason_codes":[]},{"layer":"artifact_identity","layer_state":"passed","reason_codes":[]},{"layer":"checksum_integrity","layer_state":"passed","reason_codes":[]},{"layer":"package_completeness","layer_state":"passed","reason_codes":[]},{"layer":"evidence_closure","layer_state":"passed","reason_codes":[]},{"layer":"p7_4_report_schema","layer_state":"passed","reason_codes":[]},{"layer":"cross_phase_identity_binding","layer_state":"passed","reason_codes":[]},{"layer":"replay_reproduction","layer_state":"passed","reason_codes":[]},{"layer":"result_equivalence","layer_state":"passed","reason_codes":[]},{"layer":"replay_fact_drift","layer_state":"passed","reason_codes":[]},{"layer":"proof_fact_comparability","layer_state":"not_applicable","reason_codes":[]},{"layer":"proof_parity_eligibility","layer_state":"passed","reason_codes":[]}],"primary_reason":null,"proof_correctness":"not_evaluated","proof_fact_drift":{"comparable_proof_fact_count":0,"proof_drift_count":0,"proof_drift_items":[]},"proof_parity":"not_evaluated","proof_parity_eligibility":{"proof_correctness":"not_evaluated","proof_parity":"not_evaluated","proof_parity_eligible":false,"proof_parity_reason":"FROZEN_PROOF_REPRESENTATION_UNAVAILABLE"},"proof_parity_eligible":false,"reason_codes":[],"replay_fact_drift":{"comparable_replay_fact_count":17,"replay_fact_drift_count":0,"replay_fact_drift_items":[]},"report_version":"external-layered-validation-report-v1","reproduction_result":{"canonical_bytes_matched":true,"canonical_sha256_matched":true,"reproduced_report_sha256":"199aacdc0d1341d4fd799da10d1405e034065da13fa2bfbc865af1358e53fc24","reproduction_attempted":true},"source_case_id":"freertos_btf_4cores","source_replay_state":"replay_pass","validation_profile_id":"p7.5-layered-validation-v1","validation_profile_identity":"4114e58b3a09bef2cda27d33b1172e3c379a204f4bbcbc4384b08e8be118eaaf","validation_state":"validation_pass"}
